teacher_id,name,headline,profile_completion_percentage,profile_visibility,preferred_teaching_modes,willing_to_relocate,hourly_rate,monthly_salary_expectation,available_start_date,cv_resume_url,video_intro_url,linkedin_profile_url,created_at,Email,source_id,missing_fields,subject,bio,nationality,preferred_grade_level,is_currently_teacher,curriculum_experience,teaching_experience_years,current_school,school_website,current_location_country,current_location_city
,Alia Mokdad,Teacher,50,,,,,,,,,http://www.linkedin.com/in/alia-mokdad-02298171,2025-06-19T08:48:14.790142Z,alia.mokdad@gemseducation.com,54a11c2369702d9d7ed48900,,Primary Education,A dedicated educator with extensive experience across early childhood and primary education settings. Skilled in fostering a nurturing learning environment and supporting student development. Currently engaged in multiple educational roles within reputable institutions in Dubai.,Lebanese,"Elementary (Ages 6-10, Grades 1-5)",True,UAE,8.0,GEMS Education,http://www.gemseducation.com,United Arab Emirates,Dubai
,Maritza Franck,Teacher,50,,,,,,,,,http://www.linkedin.com/in/maritza-franck-699b2422,2025-06-19T08:48:14.790142Z,maritza.franck@gemseducation.com,54a28ae974686933187f4f2a,,Elementary Education,"A dedicated educator with extensive experience in teaching and educational leadership across multiple institutions. Skilled in curriculum development and student engagement, with a strong background in music education and educational administration. Committed to fostering a positive learning environment and continuous professional growth.",American,"Elementary (Ages 6-10, Grades 1-5)",True,American,24.0,GEMS Education,http://www.gemseducation.com,United Arab Emirates,Dubai
,Jouhaina Kanawati,Teacher at Sabis,45,,,,,,,,,http://www.linkedin.com/in/jouhaina-kanawati-53963b65,2025-06-19T08:48:14.790142Z,,54a4cf0d7468692cf09e1b65,"[""curriculum_experience_missing""]",Elementary Education,A dedicated educator with over 20 years of teaching experience across multiple international schools. Skilled in fostering student development and implementing diverse curricula. Currently teaching at a prominent educational organization in Dubai.,Lebanese,"Elementary (Ages 6-10, Grades 1-5)",True,Not specified,20.0,Sabis Educational Services,http://www.sabis.net,United Arab Emirates,Dubai
,Tasja Wyk,Curriculum Coordinator and FS 2 Teacher at Jumeirah International Nursery,50,,,,,,,,,http://www.linkedin.com/in/tasja-van-wyk-247a0450,2025-06-19T08:48:14.790142Z,,54a5f2307468692fa2fbfbb5,,Early Childhood Education,A dedicated early childhood educator with extensive experience across multiple nurseries and educational institutions in the UAE and Abu Dhabi. Skilled in curriculum coordination and fostering a nurturing learning environment for young children. Committed to professional development and enhancing early childhood learning experiences.,South African,Early Childhood (Ages 0-5),True,Cambridge,20.0,Jumeirah International Nurseries,http://www.jinspire.com,United Arab Emirates,Dubai
,Rob Kesterton,Teacher at GEMS Education,50,,,,,,,,,http://www.linkedin.com/in/rob-kesterton-b0a32a8a,2025-06-19T08:48:14.790142Z,r.kesterton_jcd@gemsedu.com,54a8b9117468692d1c657304,,Elementary Education,"A dedicated educator with over a decade of experience in primary education, committed to fostering a positive learning environment and supporting student development. Experienced in curriculum delivery within international school settings.",British,"Elementary (Ages 6-10, Grades 1-5)",True,British,13.0,GEMS Education,http://www.gemseducation.com,United Arab Emirates,Dubai
