teacher_id,name,headline,profile_completion_percentage,profile_visibility,preferred_teaching_modes,willing_to_relocate,hourly_rate,monthly_salary_expectation,available_start_date,cv_resume_url,video_intro_url,linkedin_profile_url,created_at,Email,source_id,missing_fields,subject,bio,nationality,preferred_grade_level,is_currently_teacher,curriculum_experience,teaching_experience_years,current_school,current_location_country,current_location_city
,Alia Mokdad,Teacher,40,,,,,,,,,http://www.linkedin.com/in/alia-mokdad-02298171,2025-06-19T08:27:41.339561Z,alia.mokdad@gemseducation.com,54a11c2369702d9d7ed48900,"[""curriculum_experience_missing"", ""school_website_missing""]",Elementary Education,A dedicated educator with a focus on fostering a positive learning environment for young learners. Committed to supporting student development and academic success through engaging teaching methods.,Lebanese,"Elementary (Ages 6-10, Grades 1-5)",False,Not specified,5.0,GEMS Education,United Arab Emirates,Dubai
,Maritza Franck,Teacher,25,,,,,,,,,http://www.linkedin.com/in/maritza-franck-699b2422,2025-06-19T08:27:41.339561Z,maritza.franck@gemseducation.com,54a28ae974686933187f4f2a,"[""curriculum_experience_missing"", ""current_school_missing"", ""school_website_missing"", ""current_location_country_missing"", ""current_location_city_missing""]",Elementary Education,"A dedicated educator with a focus on fostering student growth and engagement. Experienced in classroom management and curriculum development, committed to creating a positive learning environment.",Dominican,"Elementary (Ages 6-10, Grades 1-5)",False,Not specified,0.0
,Jouhaina Kanawati,Teacher at Sabis,40,,,,,,,,,http://www.linkedin.com/in/jouhaina-kanawati-53963b65,2025-06-19T08:27:41.339561Z,,54a4cf0d7468692cf09e1b65,"[""curriculum_experience_missing"", ""school_website_missing""]",Elementary Education,"A dedicated educator with experience in elementary teaching, committed to fostering a positive learning environment and supporting student development. Possesses a strong passion for education and continuous professional growth.",Lebanese,"Elementary (Ages 6-10, Grades 1-5)",True,Not specified,5.0,Sabis,Lebanon,Beirut
,Tasja Wyk,Curriculum Coordinator and FS 2 Teacher at Jumeirah International Nursery,40,,,,,,,,,http://www.linkedin.com/in/tasja-van-wyk-247a0450,2025-06-19T08:27:41.339561Z,,54a5f2307468692fa2fbfbb5,"[""curriculum_experience_missing"", ""school_website_missing""]",Early Childhood Education,A dedicated early childhood educator with extensive experience in curriculum coordination and teaching young learners. Committed to fostering a nurturing and engaging learning environment for preschool children.,South African,Early Childhood (Ages 0-5),True,Not specified,10.0,Jumeirah International Nursery,United Arab Emirates,Dubai
,Rob Kesterton,Teacher at GEMS Education,45,,,,,,,,,http://www.linkedin.com/in/rob-kesterton-b0a32a8a,2025-06-19T08:27:41.339561Z,r.kesterton_jcd@gemsedu.com,54a8b9117468692d1c657304,"[""school_website_missing""]",Mathematics,"A dedicated mathematics educator with extensive experience in secondary education, committed to fostering student understanding and engagement. Possesses a strong background in curriculum development and classroom management.",British,"High School (Ages 14-18, Grades 9-12)",True,British,10.0,GEMS Education,United Arab Emirates,Dubai
